import ImgRunning1 from "../img/races/missing.jpg";
import TheBigHalf2019 from "../img/races/TheBigHalf2019.jpg";
import TheBigHalf2020 from "../img/races/TheBigHalf2020.jpg";
import TheBigHalf2021 from "../img/races/TheBigHalf2021.jpg";
import Hatfield52018 from "../img/races/Hatfied2018.jpg";
import MKWinterHalf2018 from "../img/races/MKWinterHalf2018.jpg";
import ValenciaMarathon from "../img/races/ValenciaMarathon.jpg";
import MagnaCartaHalf from "../img/races/MagnaCartaHalf.jpg";
import MoRun2018 from "../img/races/MoRun2018.jpg";
import MoRun2019 from "../img/races/MoRun2019.jpg";
import Herts10k2018 from "../img/races/Herts10k.jpg";
import YorkMarathon2019 from "../img/races/YorkMarathon2019.jpg";
import ReadingHalf2021 from "../img/races/ReadingHalf2021.jpg";
import LoveLutonHalf2021 from "../img/races/LoveLutonHalf2021.jpg";
import ManchesterMarathon from "../img/races/ManchesterMarathon.jpg";
import Hatfield52021 from "../img/races/Hatfied2021.jpg";
import YorkMarathon2021 from "../img/races/YorkMarathon2021.jpg";
import LondonMarathon2021 from "../img/races/LondonMarathon2021.jpg";
import Vitality10k2019 from "../img/races/Vitality10k2019.jpg";
import DorneyHalf2022 from "../img/races/DorneyHalf2020.jpg";

import runningNice1 from "../img/races/runningNice1.jpg";
import runningNice1HiRes from "../img/races/runningNice1HiRes.jpg";
import runningNice2 from "../img/races/runningNice2.jpg";
import runningNice3 from "../img/races/runningNice3.jpg";
import runningNice4 from "../img/races/runningNice4.jpg";
import runningNice5 from "../img/races/runningNice5.jpg";
import runningNice6 from "../img/races/runningNice6.jpg";
import runningNice7 from "../img/races/runningNice7.jpg";
import runningNice8 from "../img/races/runningNice8.jpg";
import runningNice9 from "../img/races/runningNice9.jpg";

const DataRaces = [
  {
    "Race": "Hatfield 5",
    "Date": "26/11/2017",
    "Date2": "2017-11-26",
    "Year": "2017",
    "Distance": "5 mile",
    "Result": "00:35:54",
    "Photo": ImgRunning1,
    "PhotoAlt": runningNice3
  },
  {
    "Race": "Manchester Marathon",
    "Date": "08/04/2018",
    "Date2": "2018-04-08",
    "Year": "2018",
    "Distance": "Marathon",
    "Result": "03:59:11",
    "Photo": ManchesterMarathon,
    "PhotoAlt": runningNice2
  },
  {
    "Race": "St Albans Half",
    "Date": "10/06/2018",
    "Date2": "2018-06-10",
    "Year": "2018",
    "Distance": "Half",
    "Result": "01:49:47",
    "Photo": ImgRunning1,
    "PhotoAlt": runningNice1
  },
  {
    "Race": "Timberhonger 10K",
    "Date": "14/07/2018",
    "Date2": "2018-07-14",
    "Year": "2018",
    "Distance": "10k",
    "Result": "00:47:49",
    "Photo": ImgRunning1,
    "PhotoAlt": runningNice9
  },
  {
    "Race": "Bovingdon 10K",
    "Date": "02/09/2018",
    "Date2": "2018-09-02",
    "Year": "2018",
    "Distance": "10k",
    "Result": "00:45:34",
    "Photo": ImgRunning1,
    "PhotoAlt": runningNice8
  },
  {
    "Race": "Herts 10K",
    "Date": "14/10/2018",
    "Date2": "2018-10-14",
    "Year": "2018",
    "Distance": "10k",
    "Result": "00:43:40",
    "Photo": Herts10k2018,
    "PhotoAlt": runningNice7
  },
  {
    "Race": "Milton Keynes MoRun",
    "Date": "18/11/2018",
    "Date2": "2018-11-08",
    "Year": "2018",
    "Distance": "10k",
    "Result": "00:45:11",
    "Photo": MoRun2018,
    "PhotoAlt": runningNice6
  },
  {
    "Race": "Hatfield 5",
    "Date": "25/11/2018",
    "Date2": "2018-11-25",
    "Year": "2018",
    "Distance": "5 mile",
    "Result": "00:34:37",
    "Photo": Hatfield52018,
    "PhotoAlt": runningNice5
  },
  {
    "Race": "Milton Keynes Winter Half",
    "Date": "09/12/2018",
    "Date2": "2018-12-09",
    "Year": "2018",
    "Distance": "Half",
    "Result": "01:39:53",
    "Photo": MKWinterHalf2018,
    "PhotoAlt": runningNice4
  },
  {
    "Race": "Welwyn 10K",
    "Date": "10/02/2019",
    "Date2": "2019-10-02",
    "Year": "2019",
    "Distance": "10k",
    "Result": "00:42:56",
    "Photo": ImgRunning1,
    "PhotoAlt": runningNice3
  },
  {
    "Race": "Hillingdon Half",
    "Date": "24/02/2019",
    "Date2": "2019-02-24",
    "Year": "2019",
    "Distance": "Half",
    "Result": "01:30:45",
    "Photo": ImgRunning1,
    "PhotoAlt": runningNice2
  },
  {
    "Race": "Berkhamsted Half",
    "Date": "03/03/2019",
    "Date2": "2019-03-03",
    "Year": "2019",
    "Distance": "Half",
    "Result": "01:33:21",
    "Photo": ImgRunning1,
    "PhotoAlt": runningNice1
  },
  {
    "Race": "The Big Half",
    "Date": "10/03/2019",
    "Date2": "2019-03-10",
    "Year": "2019",
    "Distance": "Half",
    "Result": "01:30:29",
    "Photo": TheBigHalf2019,
    "PhotoAlt": runningNice9
  },
  {
    "Race": "Welwyn Half",
    "Date": "17/03/2019",
    "Date2": "2019-03-17",
    "Year": "2019",
    "Distance": "Half",
    "Result": "01:32:04",
    "Photo": ImgRunning1,
    "PhotoAlt": runningNice8
  },
  {
    "Race": "Magna Carta Half",
    "Date": "13/04/2019",
    "Date2": "2019-04-13",
    "Year": "2019",
    "Distance": "Half",
    "Result": "01:29:06",
    "Photo": MagnaCartaHalf,
    "PhotoAlt": runningNice7
  },
  {
    "Race": "Watford 10K",
    "Date": "07/05/2019",
    "Date2": "2019-05-07",
    "Year": "2019",
    "Distance": "10k",
    "Result": "00:41:24",
    "Photo": ImgRunning1,
    "PhotoAlt": runningNice6
  },
  {
    "Race": "Pednor 5",
    "Date": "06/05/2019",
    "Date2": "2019-05-06",
    "Year": "2019",
    "Distance": "5 mile",
    "Result": "00:33:18",
    "Photo": ImgRunning1,
    "PhotoAlt": runningNice5
  },
  {
    "Race": "Vitality 10K",
    "Date": "27/05/2019",
    "Date2": "2019-05-27",
    "Year": "2019",
    "Distance": "10k",
    "Result": "00:41:28",
    "Photo": Vitality10k2019,
    "PhotoAlt": runningNice4
  },
  {
    "Race": "Welwyn 10K",
    "Date": "23/06/2019",
    "Date2": "2019-06-23",
    "Year": "2019",
    "Distance": "10k",
    "Result": "00:41:57",
    "Photo": ImgRunning1,
    "PhotoAlt": runningNice3
  },
  {
    "Race": "Waddesden 5K",
    "Date": "17/07/2019",
    "Date2": "2019-07-17",
    "Year": "2019",
    "Distance": "5k",
    "Result": "00:19:05",
    "Photo": ImgRunning1,
    "PhotoAlt": runningNice2
  },
  {
    "Race": "Bovingdon 10k",
    "Date": "01/09/2019",
    "Date2": "2019-09-01",
    "Year": "2019",
    "Distance": "10k",
    "Result": "00:40:08",
    "Photo": ImgRunning1,
    "PhotoAlt": runningNice1
  },
  {
    "Race": "York Marathon",
    "Date": "20/10/2019",
    "Date2": "2019-10-20",
    "Year": "2019",
    "Distance": "Marathon",
    "Result": "03:23:43",
    "Photo": YorkMarathon2019,
    "PhotoAlt": runningNice9
  },
  {
    "Race": "Ricky Road Run",
    "Date": "27/10/2019",
    "Date2": "2019-10-27",
    "Year": "2019",
    "Distance": "10 mile",
    "Result": "01:13:26",
    "Photo": ImgRunning1,
    "PhotoAlt": runningNice8
  },
  {
    "Race": "Milton Keynes MoRun",
    "Date": "17/11/2019",
    "Date2": "2019-11-17",
    "Year": "2019",
    "Distance": "10k",
    "Result": "00:42:04",
    "Photo": MoRun2019,
    "PhotoAlt": runningNice7
  },
  {
    "Race": "Hatfield 5",
    "Date": "24/11/2019",
    "Date2": "2019-11-24",
    "Year": "2019",
    "Distance": "5 mile",
    "Result": "00:32:11",
    "Photo": ImgRunning1,
    "PhotoAlt": runningNice6
  },
  {
    "Race": "Valencia Marathon",
    "Date": "01/12/2019",
    "Date2": "2019-12-01",
    "Year": "2019",
    "Distance": "Marathon",
    "Result": "03:26:04",
    "Photo": ValenciaMarathon,
    "PhotoAlt": runningNice5
  },
  {
    "Race": "Watford Half",
    "Date": "02/02/2020",
    "Date2": "2020-02-02",
    "Year": "2020",
    "Distance": "Half",
    "Result": "01:27:20",
    "Photo": ImgRunning1,
    "PhotoAlt": runningNice4
  },
  {
    "Race": "The Big Half",
    "Date": "01/03/2020",
    "Date2": "2020-03-01",
    "Year": "2020",
    "Distance": "Half",
    "Result": "01:27:07",
    "Photo": TheBigHalf2020,
    "PhotoAlt": runningNice3
  },
  {
    "Race": "St Albans 10K",
    "Date": "23/08/2020",
    "Date2": "2020-08-23",
    "Year": "2020",
    "Distance": "10k",
    "Result": "00:38:51",
    "Photo": ImgRunning1,
    "PhotoAlt": runningNice2
  },
  {
    "Race": "Herts 5K",
    "Date": "06/12/2020",
    "Date2": "2020-12-06",
    "Year": "2020",
    "Distance": "5k",
    "Result": "00:18:08",
    "Photo": ImgRunning1,
    "PhotoAlt": runningNice1
  },
  {
    "Race": "St Albans 10K",
    "Date": "02/04/2021",
    "Date2": "2021-04-02",
    "Year": "2021",
    "Distance": "10k",
    "Result": "00:36:48",
    "Photo": ImgRunning1,
    "PhotoAlt": runningNice9
  },
  {
    "Race": "The Big Half",
    "Date": "22/08/2021",
    "Date2": "2021-08-22",
    "Year": "2021",
    "Distance": "Half",
    "Result": "01:24:13",
    "Photo": TheBigHalf2021,
    "PhotoAlt": runningNice8
  },
  {
    "Race": "Milton Keynes 20",
    "Date": "05/09/2021",
    "Date2": "2021-09-05",
    "Year": "2021",
    "Distance": "20 mile",
    "Result": "02:20:55",
    "Photo": ImgRunning1,
    "PhotoAlt": runningNice7
  },
  {
    "Race": "London Marathon",
    "Date": "03/10/2021",
    "Date2": "2021-10-03",
    "Year": "2021",
    "Distance": "Marathon",
    "Result": "03:05:42",
    "Photo": LondonMarathon2021,
    "PhotoAlt": runningNice6
  },
  {
    "Race": "York Marathon",
    "Date": "17/10/2021",
    "Date2": "2021-10-17",
    "Year": "2021",
    "Distance": "Marathon",
    "Result": "03:03:57",
    "Photo": YorkMarathon2021,
    "PhotoAlt": runningNice5
  },
  {
    "Race": "Love Luton Half",
    "Date": "31/10/2021",
    "Date2": "2021-10-31",
    "Year": "2021",
    "Distance": "Half",
    "Result": "01:25:03",
    "Photo": LoveLutonHalf2021,
    "PhotoAlt": runningNice4
  },
  {
    "Race": "Reading Half",
    "Date": "07/11/2021",
    "Date2": "2021-11-07",
    "Year": "2021",
    "Distance": "Half",
    "Result": "01:22:47",
    "Photo": ReadingHalf2021,
    "PhotoAlt": runningNice3
  },
  {
    "Race": "Hatfield 5",
    "Date": "28/11/2021",
    "Date2": "2021-11-28",
    "Year": "2021",
    "Distance": "5 mile",
    "Result": "00:29:24",
    "Photo": Hatfield52021,
    "PhotoAlt": runningNice2
  },
  {
    "Race": "Dorney Half",
    "Date": "06/02/2022",
    "Date2": "2022-02-06",
    "Year": "2022",
    "Distance": "Half",
    "Result": "01:26:12",
    "Photo": DorneyHalf2022,
    "PhotoAlt": runningNice1,
    "PhotoAltHiRes": runningNice1HiRes,
    "Comment": "So much wind, gave up at 3km and treated it as a marathon pace run with a hill rep into the wind each loop."
  }
];

export default DataRaces; // Don’t forget to use export default!
